title,url
Huấn luyện viên tuyển Lào nói gì sau trận thua Việt Nam?,https://laodong.vn/bong-da/huan-luyen-vien-tuyen-lao-noi-gi-sau-tran-thua-viet-nam-981728.ldo
Bốc thăm vòng 3 FA Cup: Man United gặp lá thăm khó,https://laodong.vn/bong-da-quoc-te/boc-tham-vong-3-fa-cup-man-united-gap-la-tham-kho-981792.ldo
Chấm điểm tuyển Việt Nam sau chiến thắng trước Lào,https://laodong.vn/bong-da/cham-diem-tuyen-viet-nam-sau-chien-thang-truoc-lao-981736.ldo
Đội tuyển Việt Nam và sức bật từ AFF Cup,https://laodong.vn/bong-da/doi-tuyen-viet-nam-va-suc-bat-tu-aff-cup-981765.ldo
Những điều rút ra cho tuyển Malaysia từ trận thắng Campuchia,https://laodong.vn/the-thao/nhung-dieu-rut-ra-cho-tuyen-malaysia-tu-tran-thang-campuchia-981866.ldo
,https://laodong.vn/bong-da-quoc-te/gary-neville-arteta-nen-ban-ngay-aubameyang-981884.ldo
AFC nói gì về chiến thắng của tuyển Việt Nam trước đối thủ Lào?,https://laodong.vn/the-thao/afc-noi-gi-ve-chien-thang-cua-tuyen-viet-nam-truoc-doi-thu-lao-981881.ldo
Chấm dứt tình trạng khán giả không được nghe Quốc ca khi xem tuyển Việt Nam,https://laodong.vn/bong-da/cham-dut-tinh-trang-khan-gia-khong-duoc-nghe-quoc-ca-khi-xem-tuyen-viet-nam-981877.ldo
,https://laodong.vn/the-thao/alex-caruso-giao-vien-vat-ly-toan-nang-cua-giai-bong-ro-nba-981888.ldo
Lý Hoàng Nam: Con đường không trải hoa hồng,https://laodong.vn/the-thao/ly-hoang-nam-con-duong-khong-trai-hoa-hong-981899.ldo
"Bị chỉ trích, Davis Cup Finals lại thay đổi thể thức từ năm 2022",https://laodong.vn/the-thao/bi-chi-trich-davis-cup-finals-lai-thay-doi-the-thuc-tu-nam-2022-981949.ldo
"Trước gian khó, ý chí tự lực, tự cường dân tộc lại được khơi dậy mạnh mẽ",https://laodong.vn/video/truoc-gian-kho-y-chi-tu-luc-tu-cuong-dan-toc-lai-duoc-khoi-day-manh-me-981396.ldo
Tiền đạo của tuyển Lào khoe áo đấu của Công Phượng,https://laodong.vn/bong-da/tien-dao-cua-tuyen-lao-khoe-ao-dau-cua-cong-phuong-981790.ldo
Lượt trận cuối vòng bảng Champions League: Lo cho số phận Barcelona,https://laodong.vn/bong-da-quoc-te/luot-tran-cuoi-vong-bang-champions-league-lo-cho-so-phan-barcelona-981823.ldo
Sợ nhất là tuyển Việt Nam… thắng đậm,https://laodong.vn/the-thao/so-nhat-la-tuyen-viet-nam-thang-dam-981844.ldo
Chủ tịch Quốc hội Lào bắt đầu thăm chính thức Việt Nam,https://laodong.vn/thoi-su/chu-tich-quoc-hoi-lao-bat-dau-tham-chinh-thuc-viet-nam-981416.ldo
NBA: Nikola Jokic vượt qua Larry Bird với 60 cú đúp trong sự nghiệp,https://laodong.vn/the-thao/nba-nikola-jokic-vuot-qua-larry-bird-voi-60-cu-dup-trong-su-nghiep-981934.ldo
Tuyển Malaysia 7 năm chưa thắng tuyển Việt Nam,https://laodong.vn/bong-da/tuyen-malaysia-7-nam-chua-thang-tuyen-viet-nam-981831.ldo
5 chiếc điện thoại di động bán chạy nhất trong lịch sử,https://laodong.vn/the-gioi/5-chiec-dien-thoai-di-dong-ban-chay-nhat-trong-lich-su-981548.ldo
Những quốc gia có lực lượng không quân lớn mạnh nhất thế giới,https://laodong.vn/the-gioi/nhung-quoc-gia-co-luc-luong-khong-quan-lon-manh-nhat-the-gioi-981451.ldo
Thế giới 24h: Thông tin “đáng mừng” về biến thể Omicron,https://laodong.vn/video-the-gioi/the-gioi-24h-thong-tin-dang-mung-ve-bien-the-omicron-981659.ldo
Phát hiện hố đen khổng lồ trong một thiên hà vệ tinh nhỏ bé,https://laodong.vn/the-gioi/phat-hien-ho-den-khong-lo-trong-mot-thien-ha-ve-tinh-nho-be-981656.ldo
Nhật Bản đưa mẫu vật tiểu hành tinh gần Trái đất cho NASA,https://laodong.vn/the-gioi/nhat-ban-dua-mau-vat-tieu-hanh-tinh-gan-trai-dat-cho-nasa-981767.ldo
"Nga chuyển giao S-400 cho Ấn Độ, bất chấp Mỹ phản đối",https://laodong.vn/the-gioi/nga-chuyen-giao-s-400-cho-an-do-bat-chap-my-phan-doi-981776.ldo
6 triệu chứng nhiễm biến thể Omicron khác các biến thể còn lại,https://laodong.vn/the-gioi/6-trieu-chung-nhiem-bien-the-omicron-khac-cac-bien-the-con-lai-981771.ldo
Tỉ phú từ thiện Mỹ trao trả số cổ vật bị đánh cắp trị giá 70 triệu USD,https://laodong.vn/the-gioi/ti-phu-tu-thien-my-trao-tra-so-co-vat-bi-danh-cap-tri-gia-70-trieu-usd-981775.ldo
WHO đặc biệt cảnh báo phương pháp điều trị COVID-19 từng được ca ngợi,https://laodong.vn/the-gioi/who-dac-biet-canh-bao-phuong-phap-dieu-tri-covid-19-tung-duoc-ca-ngoi-981770.ldo
NASA ra mắt đội hình phi hành gia trong tương lai,https://laodong.vn/the-gioi/nasa-ra-mat-doi-hinh-phi-hanh-gia-trong-tuong-lai-981785.ldo
Toàn bộ khung cảnh tuyệt đẹp nhật thực toàn phần 2021 trong 1 phút,https://laodong.vn/the-gioi/toan-bo-khung-canh-tuyet-dep-nhat-thuc-toan-phan-2021-trong-1-phut-981795.ldo
Pháp bắt chước SpaceX phát triển bệ phóng tên lửa tái sử dụng,https://laodong.vn/the-gioi/phap-bat-chuoc-spacex-phat-trien-be-phong-ten-lua-tai-su-dung-981802.ldo
Vạn Lý Trường Thành của Trung Quốc có hữu dụng không?,https://laodong.vn/the-gioi/van-ly-truong-thanh-cua-trung-quoc-co-huu-dung-khong-981768.ldo
Hải Dương: Lần đầu tiên HĐND tỉnh sẽ ban hành Nghị quyết về chất vấn,https://laodong.vn/thoi-su/hai-duong-lan-dau-tien-hdnd-tinh-se-ban-hanh-nghi-quyet-ve-chat-van-981464.ldo
"Khai mạc kỳ họp thứ 4, HĐND TP Cần Thơ theo hình thức trực tuyến",https://laodong.vn/thoi-su/khai-mac-ky-hop-thu-4-hdnd-tp-can-tho-theo-hinh-thuc-truc-tuyen-981491.ldo
Muôn hoa hội tụ cùng lan toả,https://laodong.vn/thoi-su/muon-hoa-hoi-tu-cung-lan-toa-981380.ldo
Thủ tướng Chính phủ: Không để chính sách tiền tệ và tài khoá xung đột nhau,https://laodong.vn/thoi-su/thu-tuong-chinh-phu-khong-de-chinh-sach-tien-te-va-tai-khoa-xung-dot-nhau-981502.ldo
Chủ tịch Quốc hội Vương Đình Huệ hội đàm với Chủ tịch Quốc hội Lào,https://laodong.vn/thoi-su/chu-tich-quoc-hoi-vuong-dinh-hue-hoi-dam-voi-chu-tich-quoc-hoi-lao-981556.ldo
Kính viễn vọng Hubble chụp được thiên hà xoắn ốc cho nhiệm vụ đặc biệt,https://laodong.vn/the-gioi/kinh-vien-vong-hubble-chup-duoc-thien-ha-xoan-oc-cho-nhiem-vu-dac-biet-981814.ldo
Ngắm bức ảnh cực rõ nét về Mặt trời,https://laodong.vn/the-gioi/ngam-buc-anh-cuc-ro-net-ve-mat-troi-981824.ldo
"Tiêm trộn vaccine Pfizer, AstraZeneca với Moderna cho hiệu quả cao hơn",https://laodong.vn/the-gioi/tiem-tron-vaccine-pfizer-astrazeneca-voi-moderna-cho-hieu-qua-cao-hon-981860.ldo
,https://laodong.vn/the-gioi/pfizer-len-tieng-sau-khi-bi-cao-buoc-choi-xau-astrazeneca-981769.ldo
Tương lai đen tối của các rạn san hô ở tây Ấn Độ Dương,https://laodong.vn/the-gioi/tuong-lai-den-toi-cua-cac-ran-san-ho-o-tay-an-do-duong-981946.ldo
Du ngoạn ngắm cá voi sát thủ săn mồi giữa mùa đông giá lạnh ở Na Uy,https://laodong.vn/photo/du-ngoan-ngam-ca-voi-sat-thu-san-moi-giua-mua-dong-gia-lanh-o-na-uy-982064.ldo
,https://laodong.vn/video-the-gioi/the-gioi-24h-hinh-anh-mat-troi-ro-net-nhat-tu-truoc-den-nay-982031.ldo
“Nông dân số” trên vùng chè Thái Nguyên,https://laodong.vn/kinh-te/nong-dan-so-tren-vung-che-thai-nguyen-981674.ldo
"Giá vàng và ngoại tệ 7.12: Vàng bất ngờ quay đầu, USD tăng vọt",https://laodong.vn/video/gia-vang-va-ngoai-te-712-vang-bat-ngo-quay-dau-usd-tang-vot-981812.ldo
Điện lực Đắk Nông đảm bảo cấp điện trong điều kiện dịch phức tạp,https://laodong.vn/kinh-te/dien-luc-dak-nong-dam-bao-cap-dien-trong-dieu-kien-dich-phuc-tap-981779.ldo
"Israel bãi bỏ hạn ngạch nhập khẩu bơ sữa, Việt Nam thêm cơ hội",https://laodong.vn/kinh-te/israel-bai-bo-han-ngach-nhap-khau-bo-sua-viet-nam-them-co-hoi-981819.ldo
Petrovietnam về đích sớm nhiều chỉ tiêu quan trọng,https://laodong.vn/kinh-te/petrovietnam-ve-dich-som-nhieu-chi-tieu-quan-trong-981809.ldo
Chuyên gia nước ngoài chỉ cách phát triển du lịch cho Việt Nam,https://laodong.vn/kinh-te/chuyen-gia-nuoc-ngoai-chi-cach-phat-trien-du-lich-cho-viet-nam-981818.ldo
"5 cách tiết kiệm tiền, riêng cách thứ 5 phải áp dụng ngay vì sắp Tết",https://laodong.vn/kinh-te/5-cach-tiet-kiem-tien-rieng-cach-thu-5-phai-ap-dung-ngay-vi-sap-tet-981241.ldo
Thương hiệu mạnh đến từ giá trị bền vững,https://laodong.vn/kinh-te/thuong-hieu-manh-den-tu-gia-tri-ben-vung-981841.ldo
Chuyển tiền với dịch vụ Mobile Money như thế nào?,https://laodong.vn/kinh-te/chuyen-tien-voi-dich-vu-mobile-money-nhu-the-nao-981845.ldo
Không có chuyện Trung Quốc tạm ngừng nhập khẩu rau quả của Việt Nam,https://laodong.vn/kinh-te/khong-co-chuyen-trung-quoc-tam-ngung-nhap-khau-rau-qua-cua-viet-nam-981807.ldo
Hấp dẫn nghề “ăn thử”,https://laodong.vn/thi-truong/hap-dan-nghe-an-thu-981854.ldo
Đổi mới để hợp tác xã phi nông nghiệp phát triển,https://laodong.vn/kinh-te/doi-moi-de-hop-tac-xa-phi-nong-nghiep-phat-trien-981987.ldo
,https://laodong.vn/kinh-te/doanh-nghiep-du-lich-ngong-mo-cua-981978.ldo
Một chạm - Vạn tính năng cùng thẻ ghi nợ nội địa BAC A BANK Chip Contactles,https://laodong.vn/doanh-nghiep-doanh-nhan/mot-cham-van-tinh-nang-cung-the-ghi-no-noi-dia-bac-a-bank-chip-contactles-981505.ldo
"Bữa ăn nhẹ lành mạnh, tiện lợi với Sữa tươi bổ sung ngũ cốc TH true MILK LIGHT MEAL",https://laodong.vn/doanh-nghiep-doanh-nhan/bua-an-nhe-lanh-manh-tien-loi-voi-sua-tuoi-bo-sung-ngu-coc-th-true-milk-light-meal-981873.ldo
VN-Index hồi phục nhưng thanh khoản lao dốc,https://laodong.vn/kinh-te/vn-index-hoi-phuc-nhung-thanh-khoan-lao-doc-981994.ldo
,https://laodong.vn/kinh-te/co-dong-idi-sjf-lic-kho-tho-khi-co-phieu-nong-van-lau-san-981911.ldo
Lãi suất ngân hàng bất ngờ chạm đỉnh 8%/năm,https://laodong.vn/kinh-te/lai-suat-ngan-hang-bat-ngo-cham-dinh-8nam-981969.ldo
Tết Nguyên đán có thể là cơ hội để giá vàng chinh phục mốc 1.900 USD,https://laodong.vn/kinh-te/tet-nguyen-dan-co-the-la-co-hoi-de-gia-vang-chinh-phuc-moc-1900-usd-981763.ldo
BIDV tiên phong ứng dụng CCCD gắn chip trong giao dịch ngân hàng,https://laodong.vn/kinh-te/bidv-tien-phong-ung-dung-cccd-gan-chip-trong-giao-dich-ngan-hang-981995.ldo
"Thủ tướng Phạm Minh Chính tiếp, hội kiến Chủ tịch Quốc hội Lào",https://laodong.vn/thoi-su/thu-tuong-pham-minh-chinh-tiep-hoi-kien-chu-tich-quoc-hoi-lao-981610.ldo
Nêu cao trách nhiệm của người đứng đầu trong giải ngân vốn đầu tư công,https://laodong.vn/thoi-su/neu-cao-trach-nhiem-cua-nguoi-dung-dau-trong-giai-ngan-von-dau-tu-cong-981625.ldo
Việt Nam ưu tiên phát triển mối quan hệ đoàn kết đặc biệt Việt-Lào,https://laodong.vn/thoi-su/viet-nam-uu-tien-phat-trien-moi-quan-he-doan-ket-dac-biet-viet-lao-981686.ldo
"Gia hạn nộp thuế tiêu thụ đặc biệt với ô tô sản xuất, lắp ráp trong nước",https://laodong.vn/thoi-su/gia-han-nop-thue-tieu-thu-dac-biet-voi-o-to-san-xuat-lap-rap-trong-nuoc-981682.ldo
Thủ tướng mong Hà Lan hỗ trợ Việt Nam kết nối với thị trường Châu Âu,https://laodong.vn/thoi-su/thu-tuong-mong-ha-lan-ho-tro-viet-nam-ket-noi-voi-thi-truong-chau-au-981689.ldo
Việt Nam - Lào triển khai các dự án hợp tác chiến lược lâu dài,https://laodong.vn/thoi-su/viet-nam-lao-trien-khai-cac-du-an-hop-tac-chien-luoc-lau-dai-981693.ldo
"HĐND TPHCM họp cuối năm, dành 1 giờ chất vấn Chủ tịch UBND thành phố",https://laodong.vn/thoi-su/hdnd-tphcm-hop-cuoi-nam-danh-1-gio-chat-van-chu-tich-ubnd-thanh-pho-981799.ldo
"Hội đồng nhân dân TP. Hà Nội sẽ chất vấn về phòng, chống dịch COVID-19",https://laodong.vn/thoi-su/hoi-dong-nhan-dan-tp-ha-noi-se-chat-van-ve-phong-chong-dich-covid-19-981820.ldo
Đà Nẵng khai thác tốt quỹ đất nhưng lợi ích dân thụ hưởng chưa tương xứng,https://laodong.vn/thoi-su/da-nang-khai-thac-tot-quy-dat-nhung-loi-ich-dan-thu-huong-chua-tuong-xung-981827.ldo
Kinh tế TPHCM sẽ phục hồi và trở lại nhịp độ phát triển vốn có,https://laodong.vn/thoi-su/kinh-te-tphcm-se-phuc-hoi-va-tro-lai-nhip-do-phat-trien-von-co-981862.ldo
Phiên họp thứ nhất Hội đồng Quốc phòng và An ninh nhiệm kỳ 2021-2026,https://laodong.vn/thoi-su/phien-hop-thu-nhat-hoi-dong-quoc-phong-va-an-ninh-nhiem-ky-2021-2026-981896.ldo
Việt Nam ủng hộ mạnh mẽ và toàn diện công cuộc đổi mới của Lào,https://laodong.vn/thoi-su/viet-nam-ung-ho-manh-me-va-toan-dien-cong-cuoc-doi-moi-cua-lao-982058.ldo
Yên Bái thông qua 18 nghị quyết phát triển kinh tế - xã hội,https://laodong.vn/thoi-su/yen-bai-thong-qua-18-nghi-quyet-phat-trien-kinh-te-xa-hoi-982101.ldo
Xem trực tiếp PSG vs Club Brugge - Messi đá Champions League kênh nào?,https://laodong.vn/bong-da-quoc-te/xem-truc-tiep-psg-vs-club-brugge-messi-da-champions-league-kenh-nao-981956.ldo
,https://laodong.vn/bong-da/cau-lac-bo-viettel-co-bom-tan-mua-giai-vleague-2022-981984.ldo
Xem trực tiếp Real Madrid vs Inter ở Champions League trên kênh nào?,https://laodong.vn/bong-da-quoc-te/xem-truc-tiep-real-madrid-vs-inter-o-champions-league-tren-kenh-nao-981997.ldo
U21 Học viện Nutifood JMG thắng trận 6-0 tại vòng loại U21 quốc gia,https://laodong.vn/bong-da/u21-hoc-vien-nutifood-jmg-thang-tran-6-0-tai-vong-loai-u21-quoc-gia-982029.ldo
