title,url
Đội tuyển Việt Nam và sức bật từ AFF Cup,https://laodong.vn/bong-da/doi-tuyen-viet-nam-va-suc-bat-tu-aff-cup-981765.ldo
Chấm điểm tuyển Việt Nam sau chiến thắng trước Lào,https://laodong.vn/bong-da/cham-diem-tuyen-viet-nam-sau-chien-thang-truoc-lao-981736.ldo
Tiền đạo của tuyển Lào khoe áo đấu của Công Phượng,https://laodong.vn/bong-da/tien-dao-cua-tuyen-lao-khoe-ao-dau-cua-cong-phuong-981790.ldo
Bốc thăm vòng 3 FA Cup: Man United gặp lá thăm khó,https://laodong.vn/bong-da-quoc-te/boc-tham-vong-3-fa-cup-man-united-gap-la-tham-kho-981792.ldo
,https://laodong.vn/bong-da-quoc-te/gary-neville-arteta-nen-ban-ngay-aubameyang-981884.ldo
,https://laodong.vn/the-thao/alex-caruso-giao-vien-vat-ly-toan-nang-cua-giai-bong-ro-nba-981888.ldo
"Nhận định Everton - Arsenal: Vực thẳm ngay đây rồi, Benitez!",https://laodong.vn/bong-da-quoc-te/nhan-dinh-everton-arsenal-vuc-tham-ngay-day-roi-benitez-981617.ldo
Lượt trận cuối vòng bảng Champions League: Lo cho số phận Barcelona,https://laodong.vn/bong-da-quoc-te/luot-tran-cuoi-vong-bang-champions-league-lo-cho-so-phan-barcelona-981823.ldo
Những điều rút ra cho tuyển Malaysia từ trận thắng Campuchia,https://laodong.vn/the-thao/nhung-dieu-rut-ra-cho-tuyen-malaysia-tu-tran-thang-campuchia-981866.ldo
Tuyển Campuchia không thể tạo bất ngờ trước Malaysia,https://laodong.vn/bong-da/tuyen-campuchia-khong-the-tao-bat-ngo-truoc-malaysia-981641.ldo
Tuyển Malaysia yêu cầu được thay thủ môn tại AFF Cup 2020,https://laodong.vn/bong-da/tuyen-malaysia-yeu-cau-duoc-thay-thu-mon-tai-aff-cup-2020-981695.ldo
"45 phút tập, 1 trận đấu và thành quả ban đầu của Rangnick với Man United",https://laodong.vn/bong-da-quoc-te/45-phut-tap-1-tran-dau-va-thanh-qua-ban-dau-cua-rangnick-voi-man-united-981644.ldo
Tuyển Malaysia 7 năm chưa thắng tuyển Việt Nam,https://laodong.vn/bong-da/tuyen-malaysia-7-nam-chua-thang-tuyen-viet-nam-981831.ldo
Sợ nhất là tuyển Việt Nam… thắng đậm,https://laodong.vn/the-thao/so-nhat-la-tuyen-viet-nam-thang-dam-981844.ldo
,https://laodong.vn/bong-da-quoc-te/may-mu-o-psg-messi-va-cac-ngoi-sao-che-pochettino-khong-du-tam-981691.ldo
"Sau 3 năm, Phan Văn Đức mới lại ghi bàn cho tuyển Việt Nam",https://laodong.vn/the-thao/sau-3-nam-phan-van-duc-moi-lai-ghi-ban-cho-tuyen-viet-nam-981714.ldo
"Toà án Tối cao, Bộ Công an bổ nhiệm nhân sự tuần qua",https://laodong.vn/thoi-su/toa-an-toi-cao-bo-cong-an-bo-nhiem-nhan-su-tuan-qua-981278.ldo
Thủ tướng chia buồn thân nhân các gia đình có người bị nạn do mưa lũ,https://laodong.vn/thoi-su/thu-tuong-chia-buon-than-nhan-cac-gia-dinh-co-nguoi-bi-nan-do-mua-lu-981286.ldo
Hồ Chí Minh-Hành trình khát vọng 2021: Tôn vinh những tấm gương điển hình,https://laodong.vn/video-thoi-su/ho-chi-minh-hanh-trinh-khat-vong-2021-ton-vinh-nhung-tam-guong-dien-hinh-981230.ldo
,https://laodong.vn/thoi-su/chu-tich-quoc-hoi-chinh-sach-ho-tro-can-dung-va-trung-981359.ldo
,https://laodong.vn/thoi-su/ho-chi-minh-hanh-trinh-khat-vong-2021-lan-toa-nhung-viec-lam-y-nghia-981330.ldo
"Khơi dậy tinh thần cống hiến, khát vọng phát triển đất nước",https://laodong.vn/thoi-su/khoi-day-tinh-than-cong-hien-khat-vong-phat-trien-dat-nuoc-981384.ldo
"Trước gian khó, ý chí tự lực, tự cường dân tộc lại được khơi dậy mạnh mẽ",https://laodong.vn/video/truoc-gian-kho-y-chi-tu-luc-tu-cuong-dan-toc-lai-duoc-khoi-day-manh-me-981396.ldo
Chủ tịch Quốc hội Lào bắt đầu thăm chính thức Việt Nam,https://laodong.vn/thoi-su/chu-tich-quoc-hoi-lao-bat-dau-tham-chinh-thuc-viet-nam-981416.ldo
Hải Dương: Lần đầu tiên HĐND tỉnh sẽ ban hành Nghị quyết về chất vấn,https://laodong.vn/thoi-su/hai-duong-lan-dau-tien-hdnd-tinh-se-ban-hanh-nghi-quyet-ve-chat-van-981464.ldo
"Khai mạc kỳ họp thứ 4, HĐND TP Cần Thơ theo hình thức trực tuyến",https://laodong.vn/thoi-su/khai-mac-ky-hop-thu-4-hdnd-tp-can-tho-theo-hinh-thuc-truc-tuyen-981491.ldo
Việt Nam dự Diễn đàn Hợp tác đổi mới y tế quốc tế năm 2021 ở Trung Quốc,https://laodong.vn/the-gioi/viet-nam-du-dien-dan-hop-tac-doi-moi-y-te-quoc-te-nam-2021-o-trung-quoc-981531.ldo
,https://laodong.vn/kinh-te/gan-4-trieu-don-hang-duoc-chot-trong-60-gio-mua-sam-truc-tuyen-981635.ldo
Muôn hoa hội tụ cùng lan toả,https://laodong.vn/thoi-su/muon-hoa-hoi-tu-cung-lan-toa-981380.ldo
Thái Lan phát hiện ca nhiễm biến thể Omicron,https://laodong.vn/the-gioi/thai-lan-phat-hien-ca-nhiem-bien-the-omicron-981521.ldo
"Giá lợn hơi tăng mạnh, nhiều nơi vượt mốc 50.000 đồng/kg",https://laodong.vn/kinh-te/gia-lon-hoi-tang-manh-nhieu-noi-vuot-moc-50000-dongkg-981647.ldo
Kinh tế 14h: Giá vàng neo cao; Hoa lê rừng về xuôi giá rẻ vẫn ế ẩm,https://laodong.vn/kinh-te/kinh-te-14h-gia-vang-neo-cao-hoa-le-rung-ve-xuoi-gia-re-van-e-am-981654.ldo
Thủ tướng Chính phủ: Không để chính sách tiền tệ và tài khoá xung đột nhau,https://laodong.vn/thoi-su/thu-tuong-chinh-phu-khong-de-chinh-sach-tien-te-va-tai-khoa-xung-dot-nhau-981502.ldo
Chủ tịch Quốc hội Vương Đình Huệ hội đàm với Chủ tịch Quốc hội Lào,https://laodong.vn/thoi-su/chu-tich-quoc-hoi-vuong-dinh-hue-hoi-dam-voi-chu-tich-quoc-hoi-lao-981556.ldo
Việt Nam ưu tiên phát triển mối quan hệ đoàn kết đặc biệt Việt-Lào,https://laodong.vn/thoi-su/viet-nam-uu-tien-phat-trien-moi-quan-he-doan-ket-dac-biet-viet-lao-981686.ldo
"Gia hạn nộp thuế tiêu thụ đặc biệt với ô tô sản xuất, lắp ráp trong nước",https://laodong.vn/thoi-su/gia-han-nop-thue-tieu-thu-dac-biet-voi-o-to-san-xuat-lap-rap-trong-nuoc-981682.ldo
"Thủ tướng Phạm Minh Chính tiếp, hội kiến Chủ tịch Quốc hội Lào",https://laodong.vn/thoi-su/thu-tuong-pham-minh-chinh-tiep-hoi-kien-chu-tich-quoc-hoi-lao-981610.ldo
Nêu cao trách nhiệm của người đứng đầu trong giải ngân vốn đầu tư công,https://laodong.vn/thoi-su/neu-cao-trach-nhiem-cua-nguoi-dung-dau-trong-giai-ngan-von-dau-tu-cong-981625.ldo
Thủ tướng mong Hà Lan hỗ trợ Việt Nam kết nối với thị trường Châu Âu,https://laodong.vn/thoi-su/thu-tuong-mong-ha-lan-ho-tro-viet-nam-ket-noi-voi-thi-truong-chau-au-981689.ldo
Việt Nam - Lào triển khai các dự án hợp tác chiến lược lâu dài,https://laodong.vn/thoi-su/viet-nam-lao-trien-khai-cac-du-an-hop-tac-chien-luoc-lau-dai-981693.ldo
Kinh tế TPHCM sẽ phục hồi và trở lại nhịp độ phát triển vốn có,https://laodong.vn/thoi-su/kinh-te-tphcm-se-phuc-hoi-va-tro-lai-nhip-do-phat-trien-von-co-981862.ldo
,https://laodong.vn/the-gioi/me-de-vaccine-astrazeneca-phan-doan-ve-an-nguy-cua-the-gioi-tuong-lai-981494.ldo
"Thời tiết cản trở cứu hộ ở núi lửa Indonesia, 27 người vẫn mất tích",https://laodong.vn/the-gioi/thoi-tiet-can-tro-cuu-ho-o-nui-lua-indonesia-27-nguoi-van-mat-tich-981600.ldo
Nhật Bản có công dân đầu tiên nhiễm biến thể Omicron,https://laodong.vn/the-gioi/nhat-ban-co-cong-dan-dau-tien-nhiem-bien-the-omicron-981618.ldo
Nga cho hoạt động lại du lịch vũ trụ,https://laodong.vn/the-gioi/nga-cho-hoat-dong-lai-du-lich-vu-tru-981604.ldo
Cuộc đua không gian giữa Mỹ và Trung Quốc bất ngờ nóng lên,https://laodong.vn/the-gioi/cuoc-dua-khong-gian-giua-my-va-trung-quoc-bat-ngo-nong-len-981582.ldo
Nga và Argentina phát hiện ca nhiễm biến thể Omicron đầu tiên,https://laodong.vn/the-gioi/nga-va-argentina-phat-hien-ca-nhiem-bien-the-omicron-dau-tien-981658.ldo
5 chiếc điện thoại di động bán chạy nhất trong lịch sử,https://laodong.vn/the-gioi/5-chiec-dien-thoai-di-dong-ban-chay-nhat-trong-lich-su-981548.ldo
Những quốc gia có lực lượng không quân lớn mạnh nhất thế giới,https://laodong.vn/the-gioi/nhung-quoc-gia-co-luc-luong-khong-quan-lon-manh-nhat-the-gioi-981451.ldo
Thế giới 24h: Thông tin “đáng mừng” về biến thể Omicron,https://laodong.vn/video-the-gioi/the-gioi-24h-thong-tin-dang-mung-ve-bien-the-omicron-981659.ldo
Phát hiện hố đen khổng lồ trong một thiên hà vệ tinh nhỏ bé,https://laodong.vn/the-gioi/phat-hien-ho-den-khong-lo-trong-mot-thien-ha-ve-tinh-nho-be-981656.ldo
6 triệu chứng nhiễm biến thể Omicron khác các biến thể còn lại,https://laodong.vn/the-gioi/6-trieu-chung-nhiem-bien-the-omicron-khac-cac-bien-the-con-lai-981771.ldo
WHO đặc biệt cảnh báo phương pháp điều trị COVID-19 từng được ca ngợi,https://laodong.vn/the-gioi/who-dac-biet-canh-bao-phuong-phap-dieu-tri-covid-19-tung-duoc-ca-ngoi-981770.ldo
Nhật Bản đưa mẫu vật tiểu hành tinh gần Trái đất cho NASA,https://laodong.vn/the-gioi/nhat-ban-dua-mau-vat-tieu-hanh-tinh-gan-trai-dat-cho-nasa-981767.ldo
"Nga chuyển giao S-400 cho Ấn Độ, bất chấp Mỹ phản đối",https://laodong.vn/the-gioi/nga-chuyen-giao-s-400-cho-an-do-bat-chap-my-phan-doi-981776.ldo
Tỉ phú từ thiện Mỹ trao trả số cổ vật bị đánh cắp trị giá 70 triệu USD,https://laodong.vn/the-gioi/ti-phu-tu-thien-my-trao-tra-so-co-vat-bi-danh-cap-tri-gia-70-trieu-usd-981775.ldo
Toàn bộ khung cảnh tuyệt đẹp nhật thực toàn phần 2021 trong 1 phút,https://laodong.vn/the-gioi/toan-bo-khung-canh-tuyet-dep-nhat-thuc-toan-phan-2021-trong-1-phut-981795.ldo
Pháp bắt chước SpaceX phát triển bệ phóng tên lửa tái sử dụng,https://laodong.vn/the-gioi/phap-bat-chuoc-spacex-phat-trien-be-phong-ten-lua-tai-su-dung-981802.ldo
,https://laodong.vn/the-gioi/pfizer-len-tieng-sau-khi-bi-cao-buoc-choi-xau-astrazeneca-981769.ldo
"Chứng khoán: Tránh bán tháo, có thể giải ngân ở các vùng hỗ trợ kế tiếp",https://laodong.vn/kinh-te/chung-khoan-tranh-ban-thao-co-the-giai-ngan-o-cac-vung-ho-tro-ke-tiep-981727.ldo
"Dịch tả lợn Châu Phi lây lan, Nga phải tăng nhập khẩu thịt lợn",https://laodong.vn/kinh-te/dich-ta-lon-chau-phi-lay-lan-nga-phai-tang-nhap-khau-thit-lon-981690.ldo
Chi cục Hải quan Cầu Treo thu ngân sách đạt cao kỉ lục,https://laodong.vn/kinh-te/chi-cuc-hai-quan-cau-treo-thu-ngan-sach-dat-cao-ki-luc-981708.ldo
"Những phương án, hình thức đấu giá biển số xe đẹp cho người dân",https://laodong.vn/infographic/nhung-phuong-an-hinh-thuc-dau-gia-bien-so-xe-dep-cho-nguoi-dan-981297.ldo
Gặp lão nông trồng ngũ quả bon sai kiếm hàng trăm triệu mỗi năm ở Hà Nội,https://laodong.vn/photo/gap-lao-nong-trong-ngu-qua-bon-sai-kiem-hang-tram-trieu-moi-nam-o-ha-noi-981633.ldo
Gói kích thích kinh tế Việt Nam vượt qua COVID-19 nên ra sao?,https://laodong.vn/kinh-te/goi-kich-thich-kinh-te-viet-nam-vuot-qua-covid-19-nen-ra-sao-981707.ldo
Nhiều ưu đãi hấp dẫn khi chuyển tiền quốc tế tại LienVietPostBank,https://laodong.vn/kinh-te/nhieu-uu-dai-hap-dan-khi-chuyen-tien-quoc-te-tai-lienvietpostbank-981639.ldo
Lộ diện 1.000 doanh nghiệp nộp thuế thu nhập lớn nhất năm 2020,https://laodong.vn/kinh-te/lo-dien-1000-doanh-nghiep-nop-thue-thu-nhap-lon-nhat-nam-2020-981789.ldo
"Giá vàng hôm nay 7.12: Đồng loạt quay đầu, triển vọng u ám",https://laodong.vn/tien-te-dau-tu/gia-vang-hom-nay-712-dong-loat-quay-dau-trien-vong-u-am-981793.ldo
“Nông dân số” trên vùng chè Thái Nguyên,https://laodong.vn/kinh-te/nong-dan-so-tren-vung-che-thai-nguyen-981674.ldo
"Giá vàng và ngoại tệ 7.12: Vàng bất ngờ quay đầu, USD tăng vọt",https://laodong.vn/video/gia-vang-va-ngoai-te-712-vang-bat-ngo-quay-dau-usd-tang-vot-981812.ldo
Không có chuyện Trung Quốc tạm ngừng nhập khẩu rau quả của Việt Nam,https://laodong.vn/kinh-te/khong-co-chuyen-trung-quoc-tam-ngung-nhap-khau-rau-qua-cua-viet-nam-981807.ldo
Chuyên gia nước ngoài chỉ cách phát triển du lịch cho Việt Nam,https://laodong.vn/kinh-te/chuyen-gia-nuoc-ngoai-chi-cach-phat-trien-du-lich-cho-viet-nam-981818.ldo
Petrovietnam về đích sớm nhiều chỉ tiêu quan trọng,https://laodong.vn/kinh-te/petrovietnam-ve-dich-som-nhieu-chi-tieu-quan-trong-981809.ldo
Điện lực Đắk Nông đảm bảo cấp điện trong điều kiện dịch phức tạp,https://laodong.vn/kinh-te/dien-luc-dak-nong-dam-bao-cap-dien-trong-dieu-kien-dich-phuc-tap-981779.ldo
,https://laodong.vn/bong-da/hlv-park-hang-seo-viet-nam-se-da-voi-malaysia-nhu-tran-chung-ket-981716.ldo
Chuyển tiền với dịch vụ Mobile Money như thế nào?,https://laodong.vn/kinh-te/chuyen-tien-voi-dich-vu-mobile-money-nhu-the-nao-981845.ldo
"Bữa ăn nhẹ lành mạnh, tiện lợi với Sữa tươi bổ sung ngũ cốc TH true MILK LIGHT MEAL",https://laodong.vn/doanh-nghiep-doanh-nhan/bua-an-nhe-lanh-manh-tien-loi-voi-sua-tuoi-bo-sung-ngu-coc-th-true-milk-light-meal-981873.ldo
Tuyển Thái Lan sắp có lực lượng mạnh nhất dự AFF Cup,https://laodong.vn/photo/tuyen-thai-lan-sap-co-luc-luong-manh-nhat-du-aff-cup-981719.ldo
"Tuyển Việt Nam nghỉ 6 ngày trước khi đấu Malaysia, lợi hay hại?",https://laodong.vn/bong-da/tuyen-viet-nam-nghi-6-ngay-truoc-khi-dau-malaysia-loi-hay-hai-981720.ldo
Huấn luyện viên tuyển Lào nói gì sau trận thua Việt Nam?,https://laodong.vn/bong-da/huan-luyen-vien-tuyen-lao-noi-gi-sau-tran-thua-viet-nam-981728.ldo
